utterance|intent|domain|dialogue_id
are there dog shows going on near new york city|recommendation_events|HWU64|single_sen
is there a food festival in the area|recommendation_events|HWU64|single_sen
is there any event around|recommendation_events|HWU64|single_sen
what do they have going on at young circle this week|recommendation_events|HWU64|single_sen
what events are happening near me|recommendation_events|HWU64|single_sen
show local events|recommendation_events|HWU64|single_sen
what is there to do in new york city|recommendation_events|HWU64|single_sen
searching on holidays in my location|recommendation_events|HWU64|single_sen
what is happening in town tonight|recommendation_events|HWU64|single_sen
can you find me a street fair in the neighborhood|recommendation_events|HWU64|single_sen
any events this weekend in pondichery|recommendation_events|HWU64|single_sen
what's the next event at the library|recommendation_events|HWU64|single_sen
can you tell me what kind of show can i go tonight in miami|recommendation_events|HWU64|single_sen
what events are happening today|recommendation_events|HWU64|single_sen
get local events|recommendation_events|HWU64|single_sen
what's happening near me this week|recommendation_events|HWU64|single_sen
list saturday night events near current location|recommendation_events|HWU64|single_sen
show me upcoming events in chicago|recommendation_events|HWU64|single_sen
what exhibits or shows are scheduled at the metropolitan theater|recommendation_events|HWU64|single_sen
recommend a blue grass band event within twenty miles of manchester ma this week|recommendation_events|HWU64|single_sen
badminton|recommendation_events|HWU64|single_sen
what kind of musical events are happening around here this week|recommendation_events|HWU64|single_sen
events upcoming|recommendation_events|HWU64|single_sen
i would be happy if you update me the events going on our area|recommendation_events|HWU64|single_sen
what's happening here|recommendation_events|HWU64|single_sen
list local ongoing exhibitions|recommendation_events|HWU64|single_sen
local show|recommendation_events|HWU64|single_sen
what movie can i watch tonight on the theater here in boston|recommendation_events|HWU64|single_sen
list events nearby new york|recommendation_events|HWU64|single_sen
what is going on in me area today|recommendation_events|HWU64|single_sen
please show me a list of entertainment options in my area|recommendation_events|HWU64|single_sen
what happens on the fourth of july|recommendation_events|HWU64|single_sen
things to do in my area|recommendation_events|HWU64|single_sen
what bands are playing in town this weekend|recommendation_events|HWU64|single_sen
where is the event venue|recommendation_events|HWU64|single_sen
what events are going on around my place|recommendation_events|HWU64|single_sen
what kind of free activities can i do locally this week|recommendation_events|HWU64|single_sen
list events in ny|recommendation_events|HWU64|single_sen
what is going on around me|recommendation_events|HWU64|single_sen
what plays are showing at the theatre|recommendation_events|HWU64|single_sen
what should i do this weekend|recommendation_events|HWU64|single_sen
tell me all local events|recommendation_events|HWU64|single_sen
any activity in the area|recommendation_events|HWU64|single_sen
i want to know what are happening now in me area|recommendation_events|HWU64|single_sen
what's going on around the neighborhood|recommendation_events|HWU64|single_sen
what's happening in my town|recommendation_events|HWU64|single_sen
whats happening in ny|recommendation_events|HWU64|single_sen
what events are going in my town this week|recommendation_events|HWU64|single_sen
show local events near me|recommendation_events|HWU64|single_sen
any specific event in washington|recommendation_events|HWU64|single_sen
what events are going on in the area|recommendation_events|HWU64|single_sen
what is going on today in biloxi|recommendation_events|HWU64|single_sen
running competitions on the west side|recommendation_events|HWU64|single_sen
what events are in me area|recommendation_events|HWU64|single_sen
to which event can i go in milan now|recommendation_events|HWU64|single_sen
what gun shows are in tulsa|recommendation_events|HWU64|single_sen
show current local events|recommendation_events|HWU64|single_sen
today's local events|recommendation_events|HWU64|single_sen
is there anything special going on nearby|recommendation_events|HWU64|single_sen
can you tell me about any local events coming up|recommendation_events|HWU64|single_sen
which book fair events are taking place next week in washington dc|recommendation_events|HWU64|single_sen
any festivals in town at this time or in the coming week|recommendation_events|HWU64|single_sen
what's around tonight|recommendation_events|HWU64|single_sen
any local activities you can recommend in my area|recommendation_events|HWU64|single_sen
please show me best run program in jodhpur|recommendation_events|HWU64|single_sen
show todays events in ny|recommendation_events|HWU64|single_sen
are there any events going on nearby|recommendation_events|HWU64|single_sen
what is happening now|recommendation_events|HWU64|single_sen
what is open late in la|recommendation_events|HWU64|single_sen
when does panama city mall open|recommendation_events|HWU64|single_sen
show me concerts in sacramento|recommendation_events|HWU64|single_sen
are there any events happening this weekend|recommendation_events|HWU64|single_sen
anything unique to do in the city today|recommendation_events|HWU64|single_sen
what can i do in charlotte|recommendation_events|HWU64|single_sen
what's going on around here this weekend|recommendation_events|HWU64|single_sen
please search for local events|recommendation_events|HWU64|single_sen
show me events in sacramento|recommendation_events|HWU64|single_sen
tell me all events for today in my city|recommendation_events|HWU64|single_sen
are there any events coming up|recommendation_events|HWU64|single_sen
what bands are playing close by|recommendation_events|HWU64|single_sen
what is happening near me|recommendation_events|HWU64|single_sen
show me where i can find a hamburger|recommendation_events|HWU64|single_sen
what are the events taking place in new york today|recommendation_events|HWU64|single_sen
which pubs participate in the jazz festival|recommendation_events|HWU64|single_sen
what activities are taking place in my area|recommendation_events|HWU64|single_sen
can you recommend some dog's how events going on in our city|recommendation_events|HWU64|single_sen
any free events in la today|recommendation_events|HWU64|single_sen
what's interesting around here|recommendation_events|HWU64|single_sen
where should i go this weekend|recommendation_events|HWU64|single_sen
what's going on tonight in sacramento|recommendation_events|HWU64|single_sen
are there any events going on in milan|recommendation_events|HWU64|single_sen
find the events|recommendation_events|HWU64|single_sen
could you suggest some fun in new york|recommendation_events|HWU64|single_sen
show latest events around new york|recommendation_events|HWU64|single_sen
show me upcoming events in the quad cities|recommendation_events|HWU64|single_sen
are there any events happening in town|recommendation_events|HWU64|single_sen
do i need to undertake any particular activity during my stay at the yellowstone national park|recommendation_events|HWU64|single_sen
tell me all the current events in my hometown|recommendation_events|HWU64|single_sen
any cultural events in california|recommendation_events|HWU64|single_sen
are there any events going on close by|recommendation_events|HWU64|single_sen
what are the local concerts tonight|recommendation_events|HWU64|single_sen
where should i go for dinner in san francisco tonight|recommendation_events|HWU64|single_sen
what is happening tomorrow|recommendation_events|HWU64|single_sen
what type of event|recommendation_events|HWU64|single_sen
fun things to do today|recommendation_events|HWU64|single_sen
show me events nearby|recommendation_events|HWU64|single_sen
refer local current events|recommendation_events|HWU64|single_sen
show me upcoming events in this area|recommendation_events|HWU64|single_sen
what events are happening in los angeles|recommendation_events|HWU64|single_sen
what is planned for today in my local area|recommendation_events|HWU64|single_sen
what is going on around here|recommendation_events|HWU64|single_sen
what's happening around me|recommendation_events|HWU64|single_sen
whats the best place to eat near here|recommendation_locations|HWU64|single_sen
whats around|recommendation_locations|HWU64|single_sen
show shops around second street|recommendation_locations|HWU64|single_sen
what's the best chicken place near me|recommendation_locations|HWU64|single_sen
where is the best pizza on sixth street|recommendation_locations|HWU64|single_sen
find a shop that sells beer|recommendation_locations|HWU64|single_sen
what stores have clearance|recommendation_locations|HWU64|single_sen
please look up local restaurants that are open now|recommendation_locations|HWU64|single_sen
what pubs are close to me|recommendation_locations|HWU64|single_sen
what is a good lave to eat near me|recommendation_locations|HWU64|single_sen
i need to know where to get chicken wings in benton ar|recommendation_locations|HWU64|single_sen
can you find me a furniture store near me|recommendation_locations|HWU64|single_sen
whats a good place to eat around midtown new york|recommendation_locations|HWU64|single_sen
are there any shopping centers nearby|recommendation_locations|HWU64|single_sen
where is a good wine bar near me|recommendation_locations|HWU64|single_sen
i want to find some chinese food what is near me|recommendation_locations|HWU64|single_sen
where is a theatre in my area|recommendation_locations|HWU64|single_sen
near by grocery|recommendation_locations|HWU64|single_sen
what mexican food is around me|recommendation_locations|HWU64|single_sen
tell me where i can go shopping in this area|recommendation_locations|HWU64|single_sen
where is the closest sweet frog|recommendation_locations|HWU64|single_sen
near by super market|recommendation_locations|HWU64|single_sen
best bar in local area|recommendation_locations|HWU64|single_sen
locate local pizza shops|recommendation_locations|HWU64|single_sen
what restaurants around here have good reviews|recommendation_locations|HWU64|single_sen
show me thai food near me|recommendation_locations|HWU64|single_sen
where can i get something to eat by the art museum|recommendation_locations|HWU64|single_sen
list all the nearby shops|recommendation_locations|HWU64|single_sen
recommend a restaurant with medium expense|recommendation_locations|HWU64|single_sen
find me the oldest hotel in washington dc|recommendation_locations|HWU64|single_sen
how many grocery stores are located in my neighborhood|recommendation_locations|HWU64|single_sen
give me all ice cream shops within two miles|recommendation_locations|HWU64|single_sen
where is the nearest atm machine|recommendation_locations|HWU64|single_sen
nearest restaurants available at this time|recommendation_locations|HWU64|single_sen
where i can find a bakery|recommendation_locations|HWU64|single_sen
where is the nearest pub in the city|recommendation_locations|HWU64|single_sen
are there any veg restaurants in phoenix|recommendation_locations|HWU64|single_sen
tea shop|recommendation_locations|HWU64|single_sen
list the shops near me|recommendation_locations|HWU64|single_sen
recommend me some shops to shopping in angel|recommendation_locations|HWU64|single_sen
where's the best and most affordable place to stay in san diego|recommendation_locations|HWU64|single_sen
where is a walking trail near me|recommendation_locations|HWU64|single_sen
will the fast food shop at the corner open today|recommendation_locations|HWU64|single_sen
where is a good place to eat cheap pakistani food|recommendation_locations|HWU64|single_sen
where is the nearest olive garden|recommendation_locations|HWU64|single_sen
what's close by for dinner|recommendation_locations|HWU64|single_sen
which is the best place to visit in this month|recommendation_locations|HWU64|single_sen
have any suggestions for local italian food|recommendation_locations|HWU64|single_sen
search for nearby chinese restaurants|recommendation_locations|HWU64|single_sen
find shoe shopping near my home|recommendation_locations|HWU64|single_sen
find me a bar in cleveland open until two am|recommendation_locations|HWU64|single_sen
markets near by|recommendation_locations|HWU64|single_sen
what's around me|recommendation_locations|HWU64|single_sen
give me the name of all the shops in my area|recommendation_locations|HWU64|single_sen
can you find a nice restaurant downtown|recommendation_locations|HWU64|single_sen
i'm looking for some dress shows can you find clothing stores within one mile|recommendation_locations|HWU64|single_sen
can you tell me the cheapest place to get ground beef|recommendation_locations|HWU64|single_sen
where can i shop as a local tourist|recommendation_locations|HWU64|single_sen
what is the best italian restaurant around here|recommendation_locations|HWU64|single_sen
what are some good restaurants near by|recommendation_locations|HWU64|single_sen
find a grocery store in town that carries creamed pickled herring|recommendation_locations|HWU64|single_sen
get me a local restaurant|recommendation_locations|HWU64|single_sen
locate nearby dining places|recommendation_locations|HWU64|single_sen
what are the best italian restaurants in los angeles|recommendation_locations|HWU64|single_sen
please look up clothing stores near me|recommendation_locations|HWU64|single_sen
find tacos near my home|recommendation_locations|HWU64|single_sen
tell me my choices for a good steak restaurant near here|recommendation_locations|HWU64|single_sen
which store's got the cheapest three pound beef rump|recommendation_locations|HWU64|single_sen
what is the best shop restaurant around angel|recommendation_locations|HWU64|single_sen
which is the nearest restaurants available|recommendation_locations|HWU64|single_sen
mobile shop|recommendation_locations|HWU64|single_sen
what's the most popular curry place in town|recommendation_locations|HWU64|single_sen
tell me pizza restaurants close by|recommendation_locations|HWU64|single_sen
i would like to know the best rating pubs in the local area|recommendation_locations|HWU64|single_sen
can you tell me a good place to eat|recommendation_locations|HWU64|single_sen
where to buy cannon cameras|recommendation_locations|HWU64|single_sen
please list the best clothing shops near me|recommendation_locations|HWU64|single_sen
hey olly tell me what shops i am near|recommendation_locations|HWU64|single_sen
what shops are round here|recommendation_locations|HWU64|single_sen
list shops in douglasville ga|recommendation_locations|HWU64|single_sen
ask a restaurant in me area|recommendation_locations|HWU64|single_sen
find me the smallest coffee shop in new orleans|recommendation_locations|HWU64|single_sen
give the list of theaters in the vicinity|recommendation_locations|HWU64|single_sen
what are the vietnamese restaurants in the area|recommendation_locations|HWU64|single_sen
what's the best pizza shop nearby|recommendation_locations|HWU64|single_sen
when does olive garden close today|recommendation_locations|HWU64|single_sen
best restaurant in local area|recommendation_locations|HWU64|single_sen
where a good restaurant|recommendation_locations|HWU64|single_sen
where can i shop around here|recommendation_locations|HWU64|single_sen
any good bike shops in oxford|recommendation_locations|HWU64|single_sen
tell me what is the nicest place to go|recommendation_locations|HWU64|single_sen
is there any grocery nearby|recommendation_locations|HWU64|single_sen
show me all the shops that i can find in milan|recommendation_locations|HWU64|single_sen
find local shops|recommendation_locations|HWU64|single_sen
help me locate a shop that sells clothes for classy ladies|recommendation_locations|HWU64|single_sen
what train companies are near me|recommendation_locations|HWU64|single_sen
i need a good shop|recommendation_locations|HWU64|single_sen
which shops can i find in milan|recommendation_locations|HWU64|single_sen
please find the most popular store in the area|recommendation_locations|HWU64|single_sen
i need a place that will deliver pizza to me in benton ar|recommendation_locations|HWU64|single_sen
wine shop|recommendation_locations|HWU64|single_sen
can you tell me about expensive sushi restaurants in west philadelphia|recommendation_locations|HWU64|single_sen
where is the nearest smoke shop|recommendation_locations|HWU64|single_sen
i want to know the best super market in this local area|recommendation_locations|HWU64|single_sen
i need some sushi what's closest|recommendation_locations|HWU64|single_sen
what bars are around me|recommendation_locations|HWU64|single_sen
what's the best italian restaurant in atlanta|recommendation_locations|HWU64|single_sen
where is the closest bar|recommendation_locations|HWU64|single_sen
please list shops within one miles from me|recommendation_locations|HWU64|single_sen
where is a great pub|recommendation_locations|HWU64|single_sen
where should i go for mexican food in me area|recommendation_locations|HWU64|single_sen
recommend pub in eighth and monte diablo|recommendation_locations|HWU64|single_sen
what pubs are close|recommendation_locations|HWU64|single_sen
name stores within ten mile radius with music|recommendation_locations|HWU64|single_sen
what restaurants are open near me|recommendation_locations|HWU64|single_sen
where can i go shopping in this area|recommendation_locations|HWU64|single_sen
where can i find a good taco truck in los angles|recommendation_locations|HWU64|single_sen
what is a good place for cruise|recommendation_locations|HWU64|single_sen
where do people shop for clothes here|recommendation_locations|HWU64|single_sen
can you recommend a cheap restaurant in this area|recommendation_locations|HWU64|single_sen
make a reservation for two at olive garden|recommendation_locations|HWU64|single_sen
show me some vegan restaurants close by|recommendation_locations|HWU64|single_sen
show me reviews of my nearest location food court|recommendation_locations|HWU64|single_sen
are there any grocery stores nearby|recommendation_locations|HWU64|single_sen
show me some food court nearest to my location|recommendation_locations|HWU64|single_sen
can you recommend good stores in this area|recommendation_locations|HWU64|single_sen
are there any good pizza places around here|recommendation_locations|HWU64|single_sen
what is the best mexican restaurant in seattle|recommendation_locations|HWU64|single_sen
list all the shops that are located in milan|recommendation_locations|HWU64|single_sen
i'm looking for a bar do you know a good one|recommendation_locations|HWU64|single_sen
where is the closest kroger|recommendation_locations|HWU64|single_sen
i wish to go for cheap shopping is there any dollars shop nearby|recommendation_locations|HWU64|single_sen
display nearby places|recommendation_locations|HWU64|single_sen
recommend me a restaurant in west chester|recommendation_locations|HWU64|single_sen
any farm markets around with local products|recommendation_locations|HWU64|single_sen
where can i get organic wheat|recommendation_locations|HWU64|single_sen
local shops|recommendation_locations|HWU64|single_sen
where is the nearest italian restaurant|recommendation_locations|HWU64|single_sen
where can i get shawarma in this area|recommendation_locations|HWU64|single_sen
tell me a nice chinese restaurant|recommendation_locations|HWU64|single_sen
is there a well rated pizza place between fourteenth and eighteenth streets|recommendation_locations|HWU64|single_sen
i want to take karate classes where are local karate studios|recommendation_locations|HWU64|single_sen
is there any salon in babaji nagar|recommendation_locations|HWU64|single_sen
what restaurant is open after midnight|recommendation_locations|HWU64|single_sen
what clothes store would you recommend here|recommendation_locations|HWU64|single_sen
please recommend a restaurant in seattle|recommendation_locations|HWU64|single_sen
where is a good place to eat in seattle|recommendation_locations|HWU64|single_sen
what pubs are near the metro station|recommendation_locations|HWU64|single_sen
where is the pharmacy in leavenworth|recommendation_locations|HWU64|single_sen
locate me the amazon restaurants|recommendation_locations|HWU64|single_sen
find gluten free bakery near me|recommendation_locations|HWU64|single_sen
which restaurant is there in shivaji nagar|recommendation_locations|HWU64|single_sen
best reviews restaurant in south sacramento|recommendation_locations|HWU64|single_sen
search for local shops|recommendation_locations|HWU64|single_sen
where are italian restaurants in me area|recommendation_locations|HWU64|single_sen
what clothing shops are close to my current location|recommendation_locations|HWU64|single_sen
nearest walmart location|recommendation_locations|HWU64|single_sen
which rom com movie can i watch in theatres around new york|recommendation_movies|HWU64|single_sen
what movies are playing at theatres near me|recommendation_movies|HWU64|single_sen
show me theatre where pirates of caribbean is playing|recommendation_movies|HWU64|single_sen
what new movies are good|recommendation_movies|HWU64|single_sen
what is the biggest blockbuster this week|recommendation_movies|HWU64|single_sen
find an oscar nominee movie|recommendation_movies|HWU64|single_sen
recommend a movie which is released last friday|recommendation_movies|HWU64|single_sen
training day|recommendation_movies|HWU64|single_sen
is swat a good movie|recommendation_movies|HWU64|single_sen
how is the new movie swat|recommendation_movies|HWU64|single_sen
what time does thor start|recommendation_movies|HWU64|single_sen
logan|recommendation_movies|HWU64|single_sen
what movies are playing at carmike cinemas|recommendation_movies|HWU64|single_sen
give me a movie for tonight|recommendation_movies|HWU64|single_sen
what movies are playing near me|recommendation_movies|HWU64|single_sen
recommend a movie playing in me area|recommendation_movies|HWU64|single_sen
recommend a movie with justin bieber|recommendation_movies|HWU64|single_sen
recommend a romantic comedy in me area|recommendation_movies|HWU64|single_sen
what are movies that are playing near me with high reviews|recommendation_movies|HWU64|single_sen
movie times tonight|recommendation_movies|HWU64|single_sen
can you tell me what movie has the best reviews|recommendation_movies|HWU64|single_sen
what are the show times for logan at the nearby theatre|recommendation_movies|HWU64|single_sen
what is a good iranian film from two thousand and sixteen|recommendation_movies|HWU64|single_sen
what movies are playing nearby|recommendation_movies|HWU64|single_sen
what new movies are played in cinemas this week|recommendation_movies|HWU64|single_sen
what movie theatres are in stephenville|recommendation_movies|HWU64|single_sen
what is the best movie to watch with a glass of wine|recommendation_movies|HWU64|single_sen
what do you suggest that i watch this weekend|recommendation_movies|HWU64|single_sen
what film should i watch|recommendation_movies|HWU64|single_sen
movies with good reviews|recommendation_movies|HWU64|single_sen
what's a good movie that's out right now|recommendation_movies|HWU64|single_sen
fast and the furious|recommendation_movies|HWU64|single_sen
what are good movies playing now|recommendation_movies|HWU64|single_sen
show me best in class theatre|recommendation_movies|HWU64|single_sen
what movies are being shown at the regal cinema|recommendation_movies|HWU64|single_sen
whats a new sci fi movie|recommendation_movies|HWU64|single_sen
suggest movies and songs that i would like but that aren't necessarily like ones i've already said i like|recommendation_movies|HWU64|single_sen
can you recommend some movies to watch in theater near me|recommendation_movies|HWU64|single_sen
what movies are playing this week|recommendation_movies|HWU64|single_sen
what is the latest action movie running in theaters|recommendation_movies|HWU64|single_sen
tell me the movie with best imdb ratings going on in theatres near me|recommendation_movies|HWU64|single_sen
movies with good rotten tomato ratings|recommendation_movies|HWU64|single_sen
what are the current movies playing in me area|recommendation_movies|HWU64|single_sen
should i watch this movie|recommendation_movies|HWU64|single_sen
what's playing at brea plaza five|recommendation_movies|HWU64|single_sen
kung fu panda three|recommendation_movies|HWU64|single_sen
when is trolls playing|recommendation_movies|HWU64|single_sen
what movies are playing tonight at nine pm at the amc nine|recommendation_movies|HWU64|single_sen
what movies are going around me|recommendation_movies|HWU64|single_sen
please check on the movies playing in theaters nearby|recommendation_movies|HWU64|single_sen
what movies are out this week|recommendation_movies|HWU64|single_sen
what are the show times of logan|recommendation_movies|HWU64|single_sen
what movie should i see|recommendation_movies|HWU64|single_sen
what are the new movies releasing|recommendation_movies|HWU64|single_sen
what's playing in the roosendaal cinema|recommendation_movies|HWU64|single_sen
confirm a movie ticket at glory theater|recommendation_movies|HWU64|single_sen
what movies are playing right now|recommendation_movies|HWU64|single_sen
what is playing at amc twenty|recommendation_movies|HWU64|single_sen
