utterance|intent|domain|dialogue_id
please add to my contact lists and send them a reminder email|email_addcontact|HWU64|single_sen
save to contacts|email_addcontact|HWU64|single_sen
add sarah as email contact|email_addcontact|HWU64|single_sen
add apahelp@yahoo dot com in my contact list|email_addcontact|HWU64|single_sen
please add smurfette@gmail dot com to my email contacts|email_addcontact|HWU64|single_sen
add email to contacts|email_addcontact|HWU64|single_sen
add dale@gmail dot com to my contacts|email_addcontact|HWU64|single_sen
please add smithjoe@email dot com to the contact information for joe smith|email_addcontact|HWU64|single_sen
add this email to a new contact|email_addcontact|HWU64|single_sen
make this email a new contact|email_addcontact|HWU64|single_sen
add john@gmail dot com to contacts|email_addcontact|HWU64|single_sen
add sam@gmail dot com to my contacts list|email_addcontact|HWU64|single_sen
add this email to my contacts|email_addcontact|HWU64|single_sen
add a new email address which is|email_addcontact|HWU64|single_sen
add a new email contact to my list|email_addcontact|HWU64|single_sen
locate the email to giant eagle and put it into my contact list|email_addcontact|HWU64|single_sen
add new email to anna|email_addcontact|HWU64|single_sen
please add contact email johndoe@yahoo dot com to john doe's contact information|email_addcontact|HWU64|single_sen
add new email to my contacts macs@gmail dot com|email_addcontact|HWU64|single_sen
please add tom to my contact list|email_addcontact|HWU64|single_sen
send an email and save the contact information for samuelwaters@hotmail dot com|email_addcontact|HWU64|single_sen
will you please put something something@gmail dot com in my contacts|email_addcontact|HWU64|single_sen
add dan@dancom to my contacts|email_addcontact|HWU64|single_sen
add apahelp@yahoo dot com to my contacts|email_addcontact|HWU64|single_sen
save this email in my contact for future use|email_addcontact|HWU64|single_sen
add a new email|email_addcontact|HWU64|single_sen
add this person's email|email_addcontact|HWU64|single_sen
please add dan's email to my contacts|email_addcontact|HWU64|single_sen
add this email to my address book|email_addcontact|HWU64|single_sen
add email address iamironman@gmail dot com|email_addcontact|HWU64|single_sen
i need you to add gary's email to my favorites|email_addcontact|HWU64|single_sen
add the email oriam@gmail dot com to my contacts|email_addcontact|HWU64|single_sen
add this email address to my contacts and send an email to|email_addcontact|HWU64|single_sen
please add a new email in my contacts from sara|email_addcontact|HWU64|single_sen
save my contacts|email_addcontact|HWU64|single_sen
i would like you to add an email to my contacts|email_addcontact|HWU64|single_sen
create new contact|email_addcontact|HWU64|single_sen
add new email to contacts|email_addcontact|HWU64|single_sen
what is the last email i received|email_query|HWU64|single_sen
refresh the inbox and update about any unread mails|email_query|HWU64|single_sen
check inbox for mail from sarah|email_query|HWU64|single_sen
have i gotten any emails from mom lately|email_query|HWU64|single_sen
tell me when i get new emails from principal lowry|email_query|HWU64|single_sen
are there any unread messages in my inbox|email_query|HWU64|single_sen
what did the clinic say about my exams|email_query|HWU64|single_sen
are there any unread emails from patrick|email_query|HWU64|single_sen
have i gotten any new emails from mary|email_query|HWU64|single_sen
did bert write me today|email_query|HWU64|single_sen
please check recent emails from new contact|email_query|HWU64|single_sen
please check if there is a new email on the inbox|email_query|HWU64|single_sen
have i received any emails since noon|email_query|HWU64|single_sen
read new messages from my wife|email_query|HWU64|single_sen
check if there any new email|email_query|HWU64|single_sen
what new emails do i have form amie|email_query|HWU64|single_sen
tell me who send the email about the boss yesterday|email_query|HWU64|single_sen
check all the new them emails and mark them star|email_query|HWU64|single_sen
can you check to see if i have any recent email alerts|email_query|HWU64|single_sen
tell me my latest email|email_query|HWU64|single_sen
what is the email i got from my girlfriend|email_query|HWU64|single_sen
when did dave matthews email me about the contract|email_query|HWU64|single_sen
look at my email|email_query|HWU64|single_sen
have i received any mail in the last hour|email_query|HWU64|single_sen
do i have any new emails from my dad|email_query|HWU64|single_sen
what was the name of my last email|email_query|HWU64|single_sen
compile information on the data breach|email_query|HWU64|single_sen
tell me about new emails|email_query|HWU64|single_sen
update my inbox please|email_query|HWU64|single_sen
how many emails have i got since yesterday|email_query|HWU64|single_sen
is there anything new in my email folder|email_query|HWU64|single_sen
did paul email me recently|email_query|HWU64|single_sen
do i have any new emails from sarah|email_query|HWU64|single_sen
please check if i got any emails from mom|email_query|HWU64|single_sen
do i have any new entries in my inbox|email_query|HWU64|single_sen
check mails|email_query|HWU64|single_sen
how is my inbox looking at the moment|email_query|HWU64|single_sen
read me the last email from stefan and oil change|email_query|HWU64|single_sen
inform me of my new emails|email_query|HWU64|single_sen
check emails for last hour|email_query|HWU64|single_sen
show me my emails from the past hour|email_query|HWU64|single_sen
please check my gmail for new mail|email_query|HWU64|single_sen
scan my inbox for any new emails from robert|email_query|HWU64|single_sen
did linda connors reply to any of my emails this morning|email_query|HWU64|single_sen
did mike send me an email|email_query|HWU64|single_sen
have i gotten any new emails|email_query|HWU64|single_sen
check email for otp sent by my bank|email_query|HWU64|single_sen
did i get any replies from jan|email_query|HWU64|single_sen
what are my new contact emails|email_query|HWU64|single_sen
please archive my read messages|email_query|HWU64|single_sen
do i have new emails from john|email_query|HWU64|single_sen
can you please read the my mom sent this morning at ten am|email_query|HWU64|single_sen
show unread new emails|email_query|HWU64|single_sen
is there any new email|email_query|HWU64|single_sen
has john sent me any new emails|email_query|HWU64|single_sen
has tom emailed me about ammunition|email_query|HWU64|single_sen
what is my recent email activity|email_query|HWU64|single_sen
can you tell me my recent emails|email_query|HWU64|single_sen
check someone's recent emails|email_query|HWU64|single_sen
what is my email from steve about|email_query|HWU64|single_sen
how many new emails since i last checked|email_query|HWU64|single_sen
update me on my emails|email_query|HWU64|single_sen
please tell me how many emails i have|email_query|HWU64|single_sen
did dan send me any emails|email_query|HWU64|single_sen
check all new emails in my inbox|email_query|HWU64|single_sen
read me new emails|email_query|HWU64|single_sen
any new emails for me|email_query|HWU64|single_sen
what is the email sent by this contact read|email_query|HWU64|single_sen
hey do i have any emails from bob about the bulldog|email_query|HWU64|single_sen
did my mom send me an email|email_query|HWU64|single_sen
do i have a new email from eric|email_query|HWU64|single_sen
any important notifications|email_query|HWU64|single_sen
check email client|email_query|HWU64|single_sen
please check email from my boss|email_query|HWU64|single_sen
let me know of any incoming emails for the last hour please|email_query|HWU64|single_sen
have i received any emails from my father|email_query|HWU64|single_sen
new messages|email_query|HWU64|single_sen
what is the latest email from zita|email_query|HWU64|single_sen
are there any new emails from robert jones|email_query|HWU64|single_sen
is there any new mail for me|email_query|HWU64|single_sen
beep when i get an email from john|email_query|HWU64|single_sen
do i have any emails from katherine|email_query|HWU64|single_sen
did i get an email from sarah|email_query|HWU64|single_sen
display latest emails|email_query|HWU64|single_sen
please read the last email for me|email_query|HWU64|single_sen
are there any new emails in outlook|email_query|HWU64|single_sen
do i have any new email|email_query|HWU64|single_sen
please check new email from andy|email_query|HWU64|single_sen
did trey sand any messages|email_query|HWU64|single_sen
who was the last person to email me|email_query|HWU64|single_sen
hey read any email to me|email_query|HWU64|single_sen
do i have any mail|email_query|HWU64|single_sen
are there any recent emails from rohit|email_query|HWU64|single_sen
please check all new email of income tax department|email_query|HWU64|single_sen
find my email for date|email_query|HWU64|single_sen
did you receive this person email|email_query|HWU64|single_sen
did i email tom on the subject of gun control|email_query|HWU64|single_sen
have i received any emails about jared's birthday|email_query|HWU64|single_sen
what and who was i emailed about last week|email_query|HWU64|single_sen
do have any new email|email_query|HWU64|single_sen
are there any new emails received after four o'clock today|email_query|HWU64|single_sen
find new email|email_query|HWU64|single_sen
any new email since last time|email_query|HWU64|single_sen
are there any emails i haven't read yet|email_query|HWU64|single_sen
check for new emails|email_query|HWU64|single_sen
did i get an email from jen last night|email_query|HWU64|single_sen
did i receive any new email|email_query|HWU64|single_sen
please check whether the email of jancy has come|email_query|HWU64|single_sen
do i have any emails from robert|email_query|HWU64|single_sen
has any mail received with an attachment|email_query|HWU64|single_sen
check to see if my mom sent me any emails|email_query|HWU64|single_sen
check any mail from amazon|email_query|HWU64|single_sen
have any emails come in since four hundred today|email_query|HWU64|single_sen
is the mail from chris about work|email_query|HWU64|single_sen
please send a notification when john replies|email_query|HWU64|single_sen
do i have a new email from sandy|email_query|HWU64|single_sen
jane doe|email_query|HWU64|single_sen
display recent email from john|email_query|HWU64|single_sen
initiate polling for new email|email_query|HWU64|single_sen
show me the latest emails from amazon|email_query|HWU64|single_sen
hey check emails|email_query|HWU64|single_sen
do i have email from my friend rachel|email_query|HWU64|single_sen
how many emails do i have in the last fifteen minutes|email_query|HWU64|single_sen
have i gotten any emails lately|email_query|HWU64|single_sen
has amy sent me any new emails|email_query|HWU64|single_sen
do i have any new emails from dan|email_query|HWU64|single_sen
read unchecked email|email_query|HWU64|single_sen
update on email|email_query|HWU64|single_sen
what were the first number of email subjects i got today|email_query|HWU64|single_sen
what new messages do i have|email_query|HWU64|single_sen
play back the last message|email_query|HWU64|single_sen
what are my newest emails|email_query|HWU64|single_sen
open email for unread mails|email_query|HWU64|single_sen
are any of my new emails from amy|email_query|HWU64|single_sen
which new emails were received|email_query|HWU64|single_sen
show me the email of jack|email_query|HWU64|single_sen
list all emails with subject contract|email_query|HWU64|single_sen
did i receive any email in the past hour|email_query|HWU64|single_sen
what are the subject line and sender from today's email inbox|email_query|HWU64|single_sen
would you go check my emails for me|email_query|HWU64|single_sen
open inbox|email_query|HWU64|single_sen
show all emails regarding the breach|email_query|HWU64|single_sen
have i received any emails from beth|email_query|HWU64|single_sen
refresh my inbox and inform me about new emails|email_query|HWU64|single_sen
do i have an email from person a|email_query|HWU64|single_sen
get contact|email_query|HWU64|single_sen
i need to see if i got any new email|email_query|HWU64|single_sen
have i got any new email from my company|email_query|HWU64|single_sen
did i get an email from mike|email_query|HWU64|single_sen
do i have any new emails in my inbox today|email_query|HWU64|single_sen
check outlook|email_query|HWU64|single_sen
are there new emails for me|email_query|HWU64|single_sen
check by inbox for me|email_query|HWU64|single_sen
check my email messages|email_query|HWU64|single_sen
has mike sent me an email|email_query|HWU64|single_sen
check emails from gary for last hour|email_query|HWU64|single_sen
pull up all emails sent to me from amazon|email_query|HWU64|single_sen
when was the last time that i spoke to john|email_querycontact|HWU64|single_sen
make a call to|email_querycontact|HWU64|single_sen
what's the email address of silvia|email_querycontact|HWU64|single_sen
please find a mail address of manoj and tell me|email_querycontact|HWU64|single_sen
check in contacts|email_querycontact|HWU64|single_sen
does mary smith live on main street|email_querycontact|HWU64|single_sen
hey ms the email address of john miller|email_querycontact|HWU64|single_sen
what is email id of john|email_querycontact|HWU64|single_sen
how many numbers are saved for alex|email_querycontact|HWU64|single_sen
what's john's home phone number|email_querycontact|HWU64|single_sen
what do you know about mary|email_querycontact|HWU64|single_sen
who is the most frequently called person in my phone book|email_querycontact|HWU64|single_sen
what is joe joe's home address|email_querycontact|HWU64|single_sen
please let me know when is sam's birthday|email_querycontact|HWU64|single_sen
call raju phone number|email_querycontact|HWU64|single_sen
open the contact alex in phonebook|email_querycontact|HWU64|single_sen
what is my daughter's phone number|email_querycontact|HWU64|single_sen
tell me the office address of my brother|email_querycontact|HWU64|single_sen
what are john's contact details|email_querycontact|HWU64|single_sen
please contact michael m from my list with this text|email_querycontact|HWU64|single_sen
show contact of john|email_querycontact|HWU64|single_sen
when is jacob's birthday|email_querycontact|HWU64|single_sen
call dad|email_querycontact|HWU64|single_sen
what's leon's email|email_querycontact|HWU64|single_sen
can i find out information about a contact|email_querycontact|HWU64|single_sen
do i have a work number for susan|email_querycontact|HWU64|single_sen
does bob live in france|email_querycontact|HWU64|single_sen
contacts please|email_querycontact|HWU64|single_sen
tell me about joose|email_querycontact|HWU64|single_sen
what is this person's contact information|email_querycontact|HWU64|single_sen
could you get john's email address for me|email_querycontact|HWU64|single_sen
find john smith in contacts|email_querycontact|HWU64|single_sen
select the information on the contact|email_querycontact|HWU64|single_sen
find all the contacts named john|email_querycontact|HWU64|single_sen
what is john smith's number|email_querycontact|HWU64|single_sen
tell me the email address for aunt ruth|email_querycontact|HWU64|single_sen
what is mr taxi's phone number it is in my contacts|email_querycontact|HWU64|single_sen
open contacts and call john smith|email_querycontact|HWU64|single_sen
can you provide me with the contact information assigned to this person|email_querycontact|HWU64|single_sen
is there a way to pull up information about a contact|email_querycontact|HWU64|single_sen
show me derek's contact information|email_querycontact|HWU64|single_sen
what's june's address nowadays|email_querycontact|HWU64|single_sen
where seth lives|email_querycontact|HWU64|single_sen
find my wife|email_querycontact|HWU64|single_sen
where does tar work currently|email_querycontact|HWU64|single_sen
give me the details of friend|email_querycontact|HWU64|single_sen
is there email id of john in the list|email_querycontact|HWU64|single_sen
fetch me the phone number of alexander|email_querycontact|HWU64|single_sen
what is jimmy johns's corporate number|email_querycontact|HWU64|single_sen
open the contact named john|email_querycontact|HWU64|single_sen
please delete the contacts that i havent spoken to in three of months|email_querycontact|HWU64|single_sen
open the profile of allen from my contact|email_querycontact|HWU64|single_sen
tell me the area code for jen k|email_querycontact|HWU64|single_sen
will you look up joe's contact information for me|email_querycontact|HWU64|single_sen
read about mary s.|email_querycontact|HWU64|single_sen
is alex saved in my contacts list|email_querycontact|HWU64|single_sen
what is mary s.'s phone number|email_querycontact|HWU64|single_sen
are my contacts mostly female or male|email_querycontact|HWU64|single_sen
search jack in contacts|email_querycontact|HWU64|single_sen
is bills pager number in my contacts|email_querycontact|HWU64|single_sen
tell me mary's cell number|email_querycontact|HWU64|single_sen
what is derek's phone number|email_querycontact|HWU64|single_sen
help me call james|email_querycontact|HWU64|single_sen
what is the home phone number of mark|email_querycontact|HWU64|single_sen
how many contacts do i have in my phone book|email_querycontact|HWU64|single_sen
tell me joe joe's home address|email_querycontact|HWU64|single_sen
check for this mail in my contact if not then add it|email_querycontact|HWU64|single_sen
do i have a home number for shelly|email_querycontact|HWU64|single_sen
please find a contact number of jayesh and tell me|email_querycontact|HWU64|single_sen
how do i reach sarah|email_querycontact|HWU64|single_sen
what is john's phone number|email_querycontact|HWU64|single_sen
do i have the address for the apple store in my contacts|email_querycontact|HWU64|single_sen
give me petey's telephone number|email_querycontact|HWU64|single_sen
who is the contact that last called me|email_querycontact|HWU64|single_sen
how many of my contacts live or work in detroit|email_querycontact|HWU64|single_sen
what's his number|email_querycontact|HWU64|single_sen
what's jesse's birthday|email_querycontact|HWU64|single_sen
find me my dad's email address|email_querycontact|HWU64|single_sen
what is a work phone number of emilia|email_querycontact|HWU64|single_sen
please give me details of allen from my contact|email_querycontact|HWU64|single_sen
do i have a number for jerry|email_querycontact|HWU64|single_sen
what is mary s.'s birthday|email_querycontact|HWU64|single_sen
how do i dial sarah|email_querycontact|HWU64|single_sen
show me my contacts|email_querycontact|HWU64|single_sen
can you pull up jeff|email_querycontact|HWU64|single_sen
tell me about mary s.|email_querycontact|HWU64|single_sen
show ana number|email_querycontact|HWU64|single_sen
what is frieda's home address|email_querycontact|HWU64|single_sen
what is mary smith's telephone number|email_querycontact|HWU64|single_sen
is this the correct area code for my boss|email_querycontact|HWU64|single_sen
tell contact mobile number|email_querycontact|HWU64|single_sen
can you tell me the contact information of jo|email_querycontact|HWU64|single_sen
jay's phone number|email_querycontact|HWU64|single_sen
is bills house number in my contacts|email_querycontact|HWU64|single_sen
what is amber stevens address it is in my contacts|email_querycontact|HWU64|single_sen
please check and tell me where is the location of toms new business|email_querycontact|HWU64|single_sen
tell me about mary s. in my contacts|email_querycontact|HWU64|single_sen
is it anyone i knows birthday this month|email_querycontact|HWU64|single_sen
do i have any missed call from patrick|email_querycontact|HWU64|single_sen
how can i contact this person|email_querycontact|HWU64|single_sen
provide contact location|email_querycontact|HWU64|single_sen
can you please give me john's email|email_querycontact|HWU64|single_sen
can you tell me the phone number of me|email_querycontact|HWU64|single_sen
please check and tell me contact details of mongomery llc company|email_querycontact|HWU64|single_sen
get me tom's number|email_querycontact|HWU64|single_sen
show me the information of friend|email_querycontact|HWU64|single_sen
contacts|email_querycontact|HWU64|single_sen
is mary smith in my contacts list|email_querycontact|HWU64|single_sen
how many work contacts are in my phone book|email_querycontact|HWU64|single_sen
search the contact|email_querycontact|HWU64|single_sen
is bills cell phone number in my contacts|email_querycontact|HWU64|single_sen
call mom|email_querycontact|HWU64|single_sen
find me someone|email_querycontact|HWU64|single_sen
what's jesse's number|email_querycontact|HWU64|single_sen
do we have morgan's office's number|email_querycontact|HWU64|single_sen
give me the number to mom|email_querycontact|HWU64|single_sen
when was the last call i received from jordan|email_querycontact|HWU64|single_sen
tell me the street address of my facebook friend george|email_querycontact|HWU64|single_sen
show dan's contact detail|email_querycontact|HWU64|single_sen
does my co worker have a home phone number|email_querycontact|HWU64|single_sen
check and tell me the address of my friend alex|email_querycontact|HWU64|single_sen
do i have the contact of tara john|email_querycontact|HWU64|single_sen
find jhonny's address|email_querycontact|HWU64|single_sen
give me contact mail id|email_querycontact|HWU64|single_sen
what is job title of jan medvesek|email_querycontact|HWU64|single_sen
what is john smith's home phone number|email_querycontact|HWU64|single_sen
may you please pull up information about a contact|email_querycontact|HWU64|single_sen
mary's contact number|email_querycontact|HWU64|single_sen
did i receive a message from kevin|email_querycontact|HWU64|single_sen
please let me know the what raj's status update in facebook|email_querycontact|HWU64|single_sen
what's rene phone number|email_querycontact|HWU64|single_sen
what is tom's phone number|email_querycontact|HWU64|single_sen
olly i need to call my mom will you check her work number for me|email_querycontact|HWU64|single_sen
what's the address for alex|email_querycontact|HWU64|single_sen
what information do you have on file in my information about bill|email_querycontact|HWU64|single_sen
link me to jeff's email|email_querycontact|HWU64|single_sen
what is john doe's address|email_querycontact|HWU64|single_sen
tell me john's phone number|email_querycontact|HWU64|single_sen
list phone and email id of robert|email_querycontact|HWU64|single_sen
which contact haven't i called in twelve months|email_querycontact|HWU64|single_sen
what is the email address for tessa|email_querycontact|HWU64|single_sen
what is bob stevens phone number it is in my contacts|email_querycontact|HWU64|single_sen
how do i contact charles|email_querycontact|HWU64|single_sen
can you give me the newest phone number for bobby mcgee|email_querycontact|HWU64|single_sen
give me charles telephone number|email_querycontact|HWU64|single_sen
rahul contact|email_querycontact|HWU64|single_sen
what is charles's email|email_querycontact|HWU64|single_sen
what is the home phone number for sarah|email_querycontact|HWU64|single_sen
where does fred work|email_querycontact|HWU64|single_sen
display address of john|email_querycontact|HWU64|single_sen
julie's information|email_querycontact|HWU64|single_sen
look up in contacts|email_querycontact|HWU64|single_sen
is it joes birthday soon|email_querycontact|HWU64|single_sen
is there a contact named allen in my list|email_querycontact|HWU64|single_sen
call vikki|email_querycontact|HWU64|single_sen
what is mom's email address|email_querycontact|HWU64|single_sen
do i have any other contact phone number for alison|email_querycontact|HWU64|single_sen
email my friend about our plans tonight|email_sendemail|HWU64|single_sen
send email to cat that i will accept job offer|email_sendemail|HWU64|single_sen
email james about the softball game james we need to get some refreshments before heading over|email_sendemail|HWU64|single_sen
can you open the reply inbox|email_sendemail|HWU64|single_sen
prepare email for susan|email_sendemail|HWU64|single_sen
inbox this mail|email_sendemail|HWU64|single_sen
reply to heather's latest email by answering no|email_sendemail|HWU64|single_sen
send an email to my assistant clara to cancel all appointments for tomorrow|email_sendemail|HWU64|single_sen
send an email for me|email_sendemail|HWU64|single_sen
send an email to my boss|email_sendemail|HWU64|single_sen
i need an email to be sent to comcastcom about my service issues|email_sendemail|HWU64|single_sen
email friend|email_sendemail|HWU64|single_sen
send an email to john|email_sendemail|HWU64|single_sen
go to email compile|email_sendemail|HWU64|single_sen
reply wishes to john by email|email_sendemail|HWU64|single_sen
send the email to john|email_sendemail|HWU64|single_sen
send the following email to bro hi come down for dinner tonight|email_sendemail|HWU64|single_sen
please answer jean's email|email_sendemail|HWU64|single_sen
respond to all that i am on my way|email_sendemail|HWU64|single_sen
send a test email to|email_sendemail|HWU64|single_sen
draft an email to kailey about work later|email_sendemail|HWU64|single_sen
answer paul's email|email_sendemail|HWU64|single_sen
please reply to my colleagues mail about his query|email_sendemail|HWU64|single_sen
hello you have a send an email to someone|email_sendemail|HWU64|single_sen
