utterance|intent|domain|dialogue_id
it is dark|iot_hue_lighton|HWU64|single_sen
clap on|iot_hue_lighton|HWU64|single_sen
i want to turn on the blue lights|iot_hue_lighton|HWU64|single_sen
turn on hall lights|iot_hue_lighton|HWU64|single_sen
turn the lights on|iot_hue_lighton|HWU64|single_sen
it's too dark here|iot_hue_lighton|HWU64|single_sen
it's too dark i can't even see my hands|iot_hue_lighton|HWU64|single_sen
turn on the lights|iot_hue_lighton|HWU64|single_sen
turn on the lamp|iot_hue_lighton|HWU64|single_sen
please turn on the lights in my house|iot_hue_lighton|HWU64|single_sen
lights out|iot_hue_lighton|HWU64|single_sen
please turn on all the outdoor lights|iot_hue_lighton|HWU64|single_sen
and the light began|iot_hue_lighton|HWU64|single_sen
switch on all the lights|iot_hue_lighton|HWU64|single_sen
light up the lights in the kitchen|iot_hue_lighton|HWU64|single_sen
turn the lights on full bright|iot_hue_lighton|HWU64|single_sen
it's dark in here|iot_hue_lighton|HWU64|single_sen
and the darkness has fallen|iot_hue_lighton|HWU64|single_sen
can you put the lights on the high setting|iot_hue_lighton|HWU64|single_sen
lights on|iot_hue_lighton|HWU64|single_sen
switch on the lights|iot_hue_lighton|HWU64|single_sen
turn all lights on|iot_hue_lighton|HWU64|single_sen
it's too dark in here|iot_hue_lighton|HWU64|single_sen
please turn on my balcony lights|iot_hue_lighton|HWU64|single_sen
turn corner light on|iot_hue_lighton|HWU64|single_sen
turn on all upstairs lights|iot_hue_lighton|HWU64|single_sen
it's awfully dark here|iot_hue_lighton|HWU64|single_sen
put the disco lights on|iot_hue_lighton|HWU64|single_sen
i need more light|iot_hue_lightup|HWU64|single_sen
make the light more visible|iot_hue_lightup|HWU64|single_sen
olly brighten the lights|iot_hue_lightup|HWU64|single_sen
can you adjust the lighting for me to be brighter|iot_hue_lightup|HWU64|single_sen
increase the intensity of the lighting in the room|iot_hue_lightup|HWU64|single_sen
i need some more lights|iot_hue_lightup|HWU64|single_sen
can you brighten up the lights please|iot_hue_lightup|HWU64|single_sen
light colour for study room|iot_hue_lightup|HWU64|single_sen
make it brighter in here|iot_hue_lightup|HWU64|single_sen
can you increase the brightness in the room|iot_hue_lightup|HWU64|single_sen
make the lights brighter|iot_hue_lightup|HWU64|single_sen
increase the brightness of the lights|iot_hue_lightup|HWU64|single_sen
can you make the room brighter|iot_hue_lightup|HWU64|single_sen
increase light brightness|iot_hue_lightup|HWU64|single_sen
can you please turn up the lights|iot_hue_lightup|HWU64|single_sen
turn the chandelier all the way up|iot_hue_lightup|HWU64|single_sen
make it brighter in here please|iot_hue_lightup|HWU64|single_sen
increase the brightness of lights bedroom|iot_hue_lightup|HWU64|single_sen
raise lights to full power|iot_hue_lightup|HWU64|single_sen
more light please|iot_hue_lightup|HWU64|single_sen
make it brighter|iot_hue_lightup|HWU64|single_sen
bring up all the runner lights|iot_hue_lightup|HWU64|single_sen
slightly raise the light|iot_hue_lightup|HWU64|single_sen
lights up|iot_hue_lightup|HWU64|single_sen
please raise the lights to max|iot_hue_lightup|HWU64|single_sen
please increase the light|iot_hue_lightup|HWU64|single_sen
brighten the lights a little bit|iot_hue_lightup|HWU64|single_sen
increase lighting|iot_hue_lightup|HWU64|single_sen
brighten of lights in living room|iot_hue_lightup|HWU64|single_sen
please make the room brighter|iot_hue_lightup|HWU64|single_sen
retrieve the light for me|iot_hue_lightup|HWU64|single_sen
make this room brighter|iot_hue_lightup|HWU64|single_sen
every light of room increase its intensity|iot_hue_lightup|HWU64|single_sen
brighten the lights in this room|iot_hue_lightup|HWU64|single_sen
please turn up the light a little|iot_hue_lightup|HWU64|single_sen
hey olly turn up the lights a little|iot_hue_lightup|HWU64|single_sen
pull up lights control|iot_hue_lightup|HWU64|single_sen
raise living room lights half way|iot_hue_lightup|HWU64|single_sen
turn up the brightness of the lights|iot_hue_lightup|HWU64|single_sen
it is too dark in here increase the brightness of the lights|iot_hue_lightup|HWU64|single_sen
a little brighter thanks|iot_hue_lightup|HWU64|single_sen
i need the lights raised can you do that|iot_hue_lightup|HWU64|single_sen
increase the light a little|iot_hue_lightup|HWU64|single_sen
brighten up the lighting|iot_hue_lightup|HWU64|single_sen
brighten the lamp next to the sofa|iot_hue_lightup|HWU64|single_sen
turn up the lights please|iot_hue_lightup|HWU64|single_sen
please turn the lights up|iot_hue_lightup|HWU64|single_sen
increase the light|iot_hue_lightup|HWU64|single_sen
add light|iot_hue_lightup|HWU64|single_sen
i can't see turn up the lights|iot_hue_lightup|HWU64|single_sen
lights brighter|iot_hue_lightup|HWU64|single_sen
please put all the lights|iot_hue_lightup|HWU64|single_sen
turn up the brightness|iot_hue_lightup|HWU64|single_sen
raise the lamp's light|iot_hue_lightup|HWU64|single_sen
brighten the lights in the hallway|iot_hue_lightup|HWU64|single_sen
increase lights please|iot_hue_lightup|HWU64|single_sen
switch up the color of the lights in the house|iot_hue_lightup|HWU64|single_sen
brighten the lights in living room|iot_hue_lightup|HWU64|single_sen
turn up the lights in the living room|iot_hue_lightup|HWU64|single_sen
please brighten the lights|iot_hue_lightup|HWU64|single_sen
up the brightness on these lights|iot_hue_lightup|HWU64|single_sen
turn up lights|iot_hue_lightup|HWU64|single_sen
raise lights|iot_hue_lightup|HWU64|single_sen
can you brighten the lights for me|iot_hue_lightup|HWU64|single_sen
give me more light|iot_hue_lightup|HWU64|single_sen
please set the brightness of lightness appropriately in kitchen|iot_hue_lightup|HWU64|single_sen
more bright|iot_hue_lightup|HWU64|single_sen
please turn the lights brighter|iot_hue_lightup|HWU64|single_sen
please raise the light i am not comfortable at this|iot_hue_lightup|HWU64|single_sen
increase light intensity|iot_hue_lightup|HWU64|single_sen
brighten lights in living room|iot_hue_lightup|HWU64|single_sen
can you turn the lights up|iot_hue_lightup|HWU64|single_sen
brighter|iot_hue_lightup|HWU64|single_sen
can we turn up the lights|iot_hue_lightup|HWU64|single_sen
please brighten the room|iot_hue_lightup|HWU64|single_sen
brighten lights|iot_hue_lightup|HWU64|single_sen
i want more light|iot_hue_lightup|HWU64|single_sen
make the light more brighter|iot_hue_lightup|HWU64|single_sen
please turn the lights up to eight|iot_hue_lightup|HWU64|single_sen
brighten the lights please|iot_hue_lightup|HWU64|single_sen
more lights please|iot_hue_lightup|HWU64|single_sen
bring up lights|iot_hue_lightup|HWU64|single_sen
change up the light colors at home|iot_hue_lightup|HWU64|single_sen
connect to lights|iot_hue_lightup|HWU64|single_sen
increase light|iot_hue_lightup|HWU64|single_sen
make the room brighter|iot_hue_lightup|HWU64|single_sen
spread some lights|iot_hue_lightup|HWU64|single_sen
can you bright the lights please|iot_hue_lightup|HWU64|single_sen
turn out the lights|iot_hue_lightup|HWU64|single_sen
brighten the lights on the front porch|iot_hue_lightup|HWU64|single_sen
turn up the lights in here please|iot_hue_lightup|HWU64|single_sen
can you raise the lights for me please|iot_hue_lightup|HWU64|single_sen
set lights to full power|iot_hue_lightup|HWU64|single_sen
turn up the lights|iot_hue_lightup|HWU64|single_sen
brighten my bedroom light|iot_hue_lightup|HWU64|single_sen
please make arrangements to make the hall so brighter|iot_hue_lightup|HWU64|single_sen
increase the brightness in this room|iot_hue_lightup|HWU64|single_sen
turn the lights higher|iot_hue_lightup|HWU64|single_sen
turn up the light|iot_hue_lightup|HWU64|single_sen
turn the lights brighter|iot_hue_lightup|HWU64|single_sen
please increase the brightness in this room|iot_hue_lightup|HWU64|single_sen
its dark in here mind turning up the light intensity|iot_hue_lightup|HWU64|single_sen
raise the light|iot_hue_lightup|HWU64|single_sen
increase brightness in the room|iot_hue_lightup|HWU64|single_sen
do more light|iot_hue_lightup|HWU64|single_sen
i want to bright the room more|iot_hue_lightup|HWU64|single_sen
set lights brightness higher|iot_hue_lightup|HWU64|single_sen
please increase the light of table lamp|iot_hue_lightup|HWU64|single_sen
increase the bright of the light|iot_hue_lightup|HWU64|single_sen
please olly put on multi colored lightning in my apartment set for festival diwali|iot_hue_lightup|HWU64|single_sen
i want to raise the light|iot_hue_lightup|HWU64|single_sen
brighten light|iot_hue_lightup|HWU64|single_sen
more light|iot_hue_lightup|HWU64|single_sen
i want the smart socket off now|iot_wemo_off|HWU64|single_sen
power down the plug socket one|iot_wemo_off|HWU64|single_sen
power off on|iot_wemo_off|HWU64|single_sen
switch off the plug socket|iot_wemo_off|HWU64|single_sen
please make the smart socket turn off|iot_wemo_off|HWU64|single_sen
turn off bedroom fan|iot_wemo_off|HWU64|single_sen
turn off my wifi|iot_wemo_off|HWU64|single_sen
i'd like you to shut off my smart plug socket now please|iot_wemo_off|HWU64|single_sen
please turn off the plug socket of my phone when it'll be charged|iot_wemo_off|HWU64|single_sen
please turn off the smart socket|iot_wemo_off|HWU64|single_sen
off mobile charger plug|iot_wemo_off|HWU64|single_sen
turn the plug off|iot_wemo_off|HWU64|single_sen
turn off kettle socket|iot_wemo_off|HWU64|single_sen
deactivate smart plug socket|iot_wemo_off|HWU64|single_sen
please turn off the smart plug socket|iot_wemo_off|HWU64|single_sen
turn off plug|iot_wemo_off|HWU64|single_sen
turn off the lamp socket|iot_wemo_off|HWU64|single_sen
turn off the socket|iot_wemo_off|HWU64|single_sen
please turn off the wemo plug socket|iot_wemo_off|HWU64|single_sen
turn off smart socket|iot_wemo_off|HWU64|single_sen
can you please turn off my wemo plug|iot_wemo_off|HWU64|single_sen
outlet off|iot_wemo_off|HWU64|single_sen
turn off sockets|iot_wemo_off|HWU64|single_sen
turn the wemo off|iot_wemo_off|HWU64|single_sen
turn off my wemo socket|iot_wemo_off|HWU64|single_sen
turn off the smart socket|iot_wemo_off|HWU64|single_sen
shut off the socket|iot_wemo_off|HWU64|single_sen
turn off the wemo plug|iot_wemo_off|HWU64|single_sen
turn socket off|iot_wemo_off|HWU64|single_sen
disable my okug|iot_wemo_off|HWU64|single_sen
hello i want to turn off my wemo plug|iot_wemo_off|HWU64|single_sen
power off the wemo plug|iot_wemo_off|HWU64|single_sen
stop powering the wemo socket|iot_wemo_off|HWU64|single_sen
switch off the power|iot_wemo_off|HWU64|single_sen
switch off the wemo plug socket|iot_wemo_off|HWU64|single_sen
turn off the tv in|iot_wemo_off|HWU64|single_sen
switch wemo plug socket off|iot_wemo_off|HWU64|single_sen
please turn off the wemo plug|iot_wemo_off|HWU64|single_sen
shut down the plug|iot_wemo_off|HWU64|single_sen
please mark the wemo socket to off|iot_wemo_off|HWU64|single_sen
the wemo plug should be turned off on|iot_wemo_off|HWU64|single_sen
turn off the fan|iot_wemo_off|HWU64|single_sen
disable smart socket|iot_wemo_off|HWU64|single_sen
keep the socket in off condition|iot_wemo_off|HWU64|single_sen
turn off my wemo plug|iot_wemo_off|HWU64|single_sen
switch off the smart plug socket now|iot_wemo_off|HWU64|single_sen
make the smart socket turn off|iot_wemo_off|HWU64|single_sen
can you please turn off the wemo plug socket|iot_wemo_off|HWU64|single_sen
i want you to turn off the plug socket before the cellphone is charged|iot_wemo_off|HWU64|single_sen
turn off the fan in the master bedroom|iot_wemo_off|HWU64|single_sen
switch off the plug point|iot_wemo_off|HWU64|single_sen
off the plug|iot_wemo_off|HWU64|single_sen
shut down sps|iot_wemo_off|HWU64|single_sen
turn off the wemo socket in the kitchen|iot_wemo_off|HWU64|single_sen
i want the wemo socket off|iot_wemo_off|HWU64|single_sen
smart plug socket off please|iot_wemo_off|HWU64|single_sen
turn off my wemo plug socket now|iot_wemo_off|HWU64|single_sen
turn off the smart plug|iot_wemo_off|HWU64|single_sen
can you turn off on the wemo plug socket|iot_wemo_off|HWU64|single_sen
shut off my living room plug socket|iot_wemo_off|HWU64|single_sen
off all type of active devices|iot_wemo_off|HWU64|single_sen
turn off my smart plug socket|iot_wemo_off|HWU64|single_sen
turn off smart plug socket|iot_wemo_off|HWU64|single_sen
switch off wemo|iot_wemo_off|HWU64|single_sen
turn off on wemo outlet|iot_wemo_off|HWU64|single_sen
socket off|iot_wemo_off|HWU64|single_sen
cut wemo power please|iot_wemo_off|HWU64|single_sen
will you please turn off the smart plug|iot_wemo_off|HWU64|single_sen
turn wemo plug socket off|iot_wemo_off|HWU64|single_sen
if idle then turn off else turn on|iot_wemo_off|HWU64|single_sen
can you turn off wemo plug socket|iot_wemo_off|HWU64|single_sen
turn off on the socket|iot_wemo_off|HWU64|single_sen
turn off wemo socket|iot_wemo_off|HWU64|single_sen
turn off my wemo plug socket|iot_wemo_off|HWU64|single_sen
turn off wemo plug in game room|iot_wemo_off|HWU64|single_sen
switch off the smart socket|iot_wemo_off|HWU64|single_sen
can you turn off the smart socket|iot_wemo_off|HWU64|single_sen
turn off socket|iot_wemo_off|HWU64|single_sen
mute your android phone when you arrive at work|iot_wemo_off|HWU64|single_sen
turn off wemo|iot_wemo_off|HWU64|single_sen
switch off the wemo plug|iot_wemo_off|HWU64|single_sen
turn on wemo plug in game room|iot_wemo_on|HWU64|single_sen
i'd like you to turn turn on the tv|iot_wemo_on|HWU64|single_sen
turn wemo on|iot_wemo_on|HWU64|single_sen
turn on the plug socket one|iot_wemo_on|HWU64|single_sen
switch on the wemo plug|iot_wemo_on|HWU64|single_sen
turn on plug|iot_wemo_on|HWU64|single_sen
switch on the plug|iot_wemo_on|HWU64|single_sen
wemo plug socket turn on|iot_wemo_on|HWU64|single_sen
turn on socket|iot_wemo_on|HWU64|single_sen
start the smart plug|iot_wemo_on|HWU64|single_sen
turn on living room radio|iot_wemo_on|HWU64|single_sen
turn on the wemo plug socket to plug in my dongle|iot_wemo_on|HWU64|single_sen
turn on kitchen light|iot_wemo_on|HWU64|single_sen
please switch on my wemo plug socket|iot_wemo_on|HWU64|single_sen
turn on the wemo|iot_wemo_on|HWU64|single_sen
start the laundry|iot_wemo_on|HWU64|single_sen
turn on the smart plug|iot_wemo_on|HWU64|single_sen
turn on the smart charger|iot_wemo_on|HWU64|single_sen
please turn on my door lock|iot_wemo_on|HWU64|single_sen
turn on the socket|iot_wemo_on|HWU64|single_sen
could you please turn on the plug|iot_wemo_on|HWU64|single_sen
make the socket available for me|iot_wemo_on|HWU64|single_sen
turn my smart plug socket on|iot_wemo_on|HWU64|single_sen
turn on wemo|iot_wemo_on|HWU64|single_sen
turn wemo plug socket on|iot_wemo_on|HWU64|single_sen
wemo socket on|iot_wemo_on|HWU64|single_sen
turn on the geyser|iot_wemo_on|HWU64|single_sen
turn on my plug|iot_wemo_on|HWU64|single_sen
power up the plug socket one|iot_wemo_on|HWU64|single_sen
on the plug|iot_wemo_on|HWU64|single_sen
turn on new smart socket|iot_wemo_on|HWU64|single_sen
turn my bathroom plug socket on|iot_wemo_on|HWU64|single_sen
activate the wemo plug socket|iot_wemo_on|HWU64|single_sen
please turn on wemo socket|iot_wemo_on|HWU64|single_sen
can you turn on the wemo plug socket|iot_wemo_on|HWU64|single_sen
please turn on my smart plug socket|iot_wemo_on|HWU64|single_sen
turn on the wemo plug|iot_wemo_on|HWU64|single_sen
turn my plug on|iot_wemo_on|HWU64|single_sen
i need to turn on the plug in my office for my computer|iot_wemo_on|HWU64|single_sen
start the oven|iot_wemo_on|HWU64|single_sen
on mobile charger plug|iot_wemo_on|HWU64|single_sen
enable smart socket|iot_wemo_on|HWU64|single_sen
turn on when plugged in else turn off|iot_wemo_on|HWU64|single_sen
times clapping sound times|iot_wemo_on|HWU64|single_sen
turn the smart plug on|iot_wemo_on|HWU64|single_sen
turn on the tv socket when i arrive home|iot_wemo_on|HWU64|single_sen
enable my plug|iot_wemo_on|HWU64|single_sen
turn on my son's room plug socket on off|iot_wemo_on|HWU64|single_sen
please turn on the wemo plug socket|iot_wemo_on|HWU64|single_sen
turn on the light socket|iot_wemo_on|HWU64|single_sen
switch on smart plug|iot_wemo_on|HWU64|single_sen
outlet on|iot_wemo_on|HWU64|single_sen
turn on this socket|iot_wemo_on|HWU64|single_sen
turn on the rice cooker socket|iot_wemo_on|HWU64|single_sen
turn on the wemo plug socket|iot_wemo_on|HWU64|single_sen
turn on my wemo socket|iot_wemo_on|HWU64|single_sen
enable wemo|iot_wemo_on|HWU64|single_sen
power on wemo|iot_wemo_on|HWU64|single_sen
turn on switch of wemo socket|iot_wemo_on|HWU64|single_sen
please turn on the smart socket|iot_wemo_on|HWU64|single_sen
turn on smart socket in dining room|iot_wemo_on|HWU64|single_sen
make the wemo plug socket turned on|iot_wemo_on|HWU64|single_sen
power yourself on|iot_wemo_on|HWU64|single_sen
add a tab to the shopping list|lists_createoradd|HWU64|single_sen
show a new list|lists_createoradd|HWU64|single_sen
add grocery shopping to my to do list|lists_createoradd|HWU64|single_sen
update my list with shoes|lists_createoradd|HWU64|single_sen
include this|lists_createoradd|HWU64|single_sen
add sugar to my shopping list|lists_createoradd|HWU64|single_sen
add every girl life by evelyn mayer to the must read list|lists_createoradd|HWU64|single_sen
add oil change to my to do list|lists_createoradd|HWU64|single_sen
this item should be added to the list|lists_createoradd|HWU64|single_sen
a new list to be created by tomorrow|lists_createoradd|HWU64|single_sen
we need milk|lists_createoradd|HWU64|single_sen
can you please create a list for me|lists_createoradd|HWU64|single_sen
add butter to the list|lists_createoradd|HWU64|single_sen
open my notes|lists_createoradd|HWU64|single_sen
i think i ran out of this can you add it to my list|lists_createoradd|HWU64|single_sen
can you create new list for me|lists_createoradd|HWU64|single_sen
can you create a new list|lists_createoradd|HWU64|single_sen
i need oranges added to my grocery list|lists_createoradd|HWU64|single_sen
add a item|lists_createoradd|HWU64|single_sen
add pick up kids from school to my to do list for today|lists_createoradd|HWU64|single_sen
add pencil to school supplies list|lists_createoradd|HWU64|single_sen
i would like to start a new list|lists_createoradd|HWU64|single_sen
remember to put carrots in there|lists_createoradd|HWU64|single_sen
add rice on the list|lists_createoradd|HWU64|single_sen
add a wrist watch to the shopping list|lists_createoradd|HWU64|single_sen
new item for list|lists_createoradd|HWU64|single_sen
please update list with new item|lists_createoradd|HWU64|single_sen
create new list for baby names|lists_createoradd|HWU64|single_sen
create appointment to list|lists_createoradd|HWU64|single_sen
i want to have a new playlist of songs|lists_createoradd|HWU64|single_sen
add apples to shopping list|lists_createoradd|HWU64|single_sen
i need you to put walk the dog on my list to do|lists_createoradd|HWU64|single_sen
remind me to order more soap|lists_createoradd|HWU64|single_sen
put milk on my shopping list|lists_createoradd|HWU64|single_sen
make a new list|lists_createoradd|HWU64|single_sen
could you create a new list for me|lists_createoradd|HWU64|single_sen
fresh list|lists_createoradd|HWU64|single_sen
add chives to my shopping list|lists_createoradd|HWU64|single_sen
add this one also|lists_createoradd|HWU64|single_sen
add ketchup to the list|lists_createoradd|HWU64|single_sen
bring up a new shopping list|lists_createoradd|HWU64|single_sen
add eggs to my grocery list|lists_createoradd|HWU64|single_sen
add shopping to my to do list|lists_createoradd|HWU64|single_sen
please make a list of thing i have to shop tomorrow|lists_createoradd|HWU64|single_sen
add eggs to the list|lists_createoradd|HWU64|single_sen
add mop to hardware store list|lists_createoradd|HWU64|single_sen
make a grocery list please|lists_createoradd|HWU64|single_sen
start a new shopping list|lists_createoradd|HWU64|single_sen
please update my grocery list with one gallon of two percent milk|lists_createoradd|HWU64|single_sen
create a new list for me please|lists_createoradd|HWU64|single_sen
add wash jeans to laundry list|lists_createoradd|HWU64|single_sen
add toothpaste to my shopping list|lists_createoradd|HWU64|single_sen
add eggs to my grocery's shopping list|lists_createoradd|HWU64|single_sen
produce a new register|lists_createoradd|HWU64|single_sen
list new|lists_createoradd|HWU64|single_sen
is there room on my grocery list for an extra item|lists_createoradd|HWU64|single_sen
add paper towels to the grocery list|lists_createoradd|HWU64|single_sen
i need to make a grocery list|lists_createoradd|HWU64|single_sen
make new list|lists_createoradd|HWU64|single_sen
create vacation list|lists_createoradd|HWU64|single_sen
add a movie name to the wish list|lists_createoradd|HWU64|single_sen
grocery list add eggs|lists_createoradd|HWU64|single_sen
i want to know could an extra item be added to my grocery list|lists_createoradd|HWU64|single_sen
create a new list called grocery store please|lists_createoradd|HWU64|single_sen
my new work schedule list|lists_createoradd|HWU64|single_sen
new list|lists_createoradd|HWU64|single_sen
new scenario time or calendar to new list|lists_createoradd|HWU64|single_sen
i want to start a new list|lists_createoradd|HWU64|single_sen
create a new list please|lists_createoradd|HWU64|single_sen
i want to make next week's to do list|lists_createoradd|HWU64|single_sen
i need to make a list of bills that are due|lists_createoradd|HWU64|single_sen
hey put carrots on that|lists_createoradd|HWU64|single_sen
add a new list|lists_createoradd|HWU64|single_sen
i want to make this week's shopping list|lists_createoradd|HWU64|single_sen
include an item to a list|lists_createoradd|HWU64|single_sen
please add oranges to my grocery list|lists_createoradd|HWU64|single_sen
please add deodorant to my shopping list|lists_createoradd|HWU64|single_sen
start creating a new list|lists_createoradd|HWU64|single_sen
create a new list for school supplies|lists_createoradd|HWU64|single_sen
make a new list for school supplies|lists_createoradd|HWU64|single_sen
i need to put together a todo list for work|lists_createoradd|HWU64|single_sen
make me a new checklist|lists_createoradd|HWU64|single_sen
add something to my list|lists_createoradd|HWU64|single_sen
please add an item in my calendar|lists_createoradd|HWU64|single_sen
please create a new list|lists_createoradd|HWU64|single_sen
put pencil on a new grocery list|lists_createoradd|HWU64|single_sen
please add sugar to my grocery list|lists_createoradd|HWU64|single_sen
create a playlist|lists_createoradd|HWU64|single_sen
add bob to my list of contacts|lists_createoradd|HWU64|single_sen
make list|lists_createoradd|HWU64|single_sen
on my grocery list please add oranges|lists_createoradd|HWU64|single_sen
please add new item to list|lists_createoradd|HWU64|single_sen
start a grocery list|lists_createoradd|HWU64|single_sen
update work out list with new items|lists_createoradd|HWU64|single_sen
create a new list by tomorrow|lists_createoradd|HWU64|single_sen
create a list of jewels to be bought|lists_createoradd|HWU64|single_sen
please find all name start with alphabetic of g and create a list|lists_createoradd|HWU64|single_sen
open up a new list|lists_createoradd|HWU64|single_sen
add the item to a list|lists_createoradd|HWU64|single_sen
make a things to do list|lists_createoradd|HWU64|single_sen
add grocery to list|lists_createoradd|HWU64|single_sen
bring up the grocery list and add|lists_createoradd|HWU64|single_sen
please add list of friends to invite for the party|lists_createoradd|HWU64|single_sen
add the item to the list|lists_createoradd|HWU64|single_sen
can you add cups to my grocery list|lists_createoradd|HWU64|single_sen
add this to a list|lists_createoradd|HWU64|single_sen
create list|lists_createoradd|HWU64|single_sen
please find all name start with alphabetic of a and create a list|lists_createoradd|HWU64|single_sen
i want to start a new list of power tools on sale at true value|lists_createoradd|HWU64|single_sen
edit list|lists_createoradd|HWU64|single_sen
put hamburger on my grocery list|lists_createoradd|HWU64|single_sen
create packing checklist|lists_createoradd|HWU64|single_sen
start a list|lists_createoradd|HWU64|single_sen
can you add gloria to my list of clients|lists_createoradd|HWU64|single_sen
add broccoli to my grocery list|lists_createoradd|HWU64|single_sen
can you create a new list in the playlist|lists_createoradd|HWU64|single_sen
add new item|lists_createoradd|HWU64|single_sen
please create a new list for me|lists_createoradd|HWU64|single_sen
begin a new list|lists_createoradd|HWU64|single_sen
hey i need you to make a list of cricket players of indian team who played for the international team in two thousand and fourteen|lists_createoradd|HWU64|single_sen
create a new list|lists_createoradd|HWU64|single_sen
re add eggs to the list|lists_createoradd|HWU64|single_sen
add car service to my list of things to do today|lists_createoradd|HWU64|single_sen
make a new list for me|lists_createoradd|HWU64|single_sen
open grocery list and add milk|lists_createoradd|HWU64|single_sen
add ashley to the wedding invite list|lists_createoradd|HWU64|single_sen
start me a new list|lists_createoradd|HWU64|single_sen
include this item|lists_createoradd|HWU64|single_sen
my new health check up new list|lists_createoradd|HWU64|single_sen
create a new list of my due bills|lists_createoradd|HWU64|single_sen
add eggs to list|lists_createoradd|HWU64|single_sen
